{
  "$schema": "https://json-schema.org/draft/2020-12/schema",
  "$id": "test-mapping.schema.json",
  "title": "The ticket-sentence to test pairing behind the Tests tab",
  "description": "Written by scripts/semcov.py (the scripted pass, every link with its evidence — a candidate, not proof) and by a cheap model through scripts/rerun-model.py into .human-review/test-mapping.json: the model is asked about every sentence that makes a claim, confirms or rejects each link the script made (`review`), and may mark a sentence `narrowed` when a scope decision the branch recorded narrows it (`decision`). The build merges the two and draws the matrix; a sentence the model has not answered shows its scripted links as unconfirmed, never as covered. A model answer names only the sentences it was asked about, only test ids from the list it was given, and only decision ids it was shown. After it, two passes can only lower what it claimed — a script rule that drops a link whose test shares nothing specific with its sentence, and a second cheap read (`reference/matrix-check-prompt.md`) that must quote the assertion line from the body — and each records what it lowered in `downgrades`.",
  "type": "object",
  "required": ["schema", "sentences"],
  "additionalProperties": false,
  "properties": {
    "schema": {"const": "test-mapping/1"},
    "note": {"type": "string"},
    "offered": {"type": "array", "items": {"type": "string"},
                "description": "Written by rerun-model.py, never by the model: the ids of every test the model was shown. A build whose coverage now lists a candidate outside this set warns that the pairing has not read every test on the card."},
    "offeredDigest": {"type": "object", "additionalProperties": {"type": "string"},
                      "description": "Written by rerun-model.py, never by the model: {test id: semcov.body_digest of its body as the model was shown it}. A build that finds another body under one of these ids warns that the test changed since the pairing read it."},
    "sentences": {"type": "array", "items": {"$ref": "#/$defs/sentence"}}
  },
  "$defs": {
    "sentence": {
      "type": "object",
      "required": ["id", "coverage", "tests"],
      "additionalProperties": false,
      "properties": {
        "id": {"type": "string", "pattern": "^s[0-9a-f]{6}(-[0-9]+)?$"},
        "coverage": {"enum": ["covered", "partial", "exercised", "missing", "n/a", "narrowed"]},
        "tests": {"type": "array", "items": {"$ref": "#/$defs/link"}},
        "gap": {"type": "string", "minLength": 1},
        "gapKind": {"enum": ["tests", "requirement"]},
        "by": {"enum": ["script", "model"]},
        "review": {"type": "array", "items": {"$ref": "#/$defs/verdict"},
                   "description": "One verdict per link the script made for this sentence: confirm (it stays in `tests`) or reject (it does not)."},
        "decision": {"type": "string", "pattern": "^d[0-9]+$",
                     "description": "`narrowed` only: the id of the recorded decision that narrows the sentence."},
        "downgrades": {"type": "array", "items": {"$ref": "#/$defs/downgrade"},
                       "description": "What the downgrade-only passes took away after the model answered: the script's sanity rule (`script`) and the second cheap read (`second read`). Never written by the model; nothing on it ever raises a link or a sentence."}
      }
    },
    "downgrade": {
      "type": "object",
      "required": ["by", "from", "to"],
      "additionalProperties": false,
      "properties": {
        "id": {"type": "string", "pattern": "^[^\\s]+:[0-9]+$",
               "description": "The link lowered; absent when the sentence itself was."},
        "by": {"enum": ["script", "second read"]},
        "from": {"enum": ["asserted", "exercised", "covered", "partial"]},
        "to": {"enum": ["exercised", "dropped", "partial", "missing"]},
        "why": {"type": "string", "minLength": 1}
      }
    },
    "verdict": {
      "type": "object",
      "required": ["id", "verdict", "why"],
      "additionalProperties": false,
      "properties": {
        "id": {"type": "string", "pattern": "^[^\\s]+:[0-9]+$"},
        "verdict": {"enum": ["confirm", "reject"]},
        "why": {"type": "string", "minLength": 1}
      }
    },
    "link": {
      "type": "object",
      "required": ["id", "strength"],
      "additionalProperties": false,
      "properties": {
        "id": {"type": "string", "pattern": "^[^\\s]+:[0-9]+$"},
        "strength": {"enum": ["asserted", "exercised"]},
        "why": {"type": "string", "minLength": 1},
        "line": {"type": "string",
                 "description": "`asserted` links: the assertion line of the test's body that proves the claim, copied verbatim. A link whose quoted line is found in the body is never dropped by the script's word filter."},
        "by": {"enum": ["script", "model"]},
        "evidence": {"type": "array", "items": {"type": "string", "minLength": 1}}
      }
    }
  }
}
