{
 "schema": "test-mapping/1",
 "sentences": [
  {
   "id": "s0dda55",
   "coverage": "covered",
   "tests": [
    {
     "id": "petclinic-frontend/src/app/visits/visits-page/visits-page.component.spec.ts:100",
     "strength": "asserted",
     "why": "compares the grid's mat-sort-header columns to date, description, pet and owner, so every column is sortable",
     "line": "expect(sortable).toEqual(['date', 'description', 'pet', 'owner']);"
    },
    {
     "id": "petclinic-test/src/visits.spec.ts:47",
     "strength": "asserted",
     "why": "clicks the Pet header and compares the rendered rows to the API's pet,asc page",
     "line": "await expect.poll(() => visitsPage.getVisitRows()).toEqual(expected);"
    }
   ],
   "review": [
    {
     "id": "petclinic-test/src/visits.spec.ts:47",
     "verdict": "confirm",
     "why": "clicks a column header and asserts the rows come back sorted by it"
    },
    {
     "id": "petclinic-frontend/src/app/visits/visits-page/visits-page.component.spec.ts:100",
     "verdict": "confirm",
     "why": "queries every th[mat-sort-header] and asserts all four columns are sortable"
    }
   ]
  },
  {
   "id": "s6c13a7",
   "coverage": "covered",
   "tests": [
    {
     "id": "petclinic-frontend/src/app/visits/visits-page/visits-page.component.spec.ts:108",
     "strength": "asserted",
     "why": "compares the page sizes the grid offers to [5, 10, 20]",
     "line": "expect(component.pageSizes).toEqual([5, 10, 20]);"
    },
    {
     "id": "petclinic-test/src/visits.spec.ts:58",
     "strength": "asserted",
     "why": "picks page size 5, goes to the next page and compares the rows to the API's page 2 of size 5",
     "line": "await expect.poll(() => visitsPage.getVisitRows()).toEqual(expected);"
    },
    {
     "id": "petclinic-frontend/src/app/visits/visits-page/visits-page.component.spec.ts:121",
     "strength": "asserted",
     "why": "choosing page size 20 navigates with size 20 and back to the first page",
     "line": "expect(navigatedTo()).toEqual({size: 20});"
    }
   ],
   "review": [
    {
     "id": "petclinic-frontend/src/app/visits/visits-page/visits-page.component.spec.ts:108",
     "verdict": "confirm",
     "why": "asserts the offered page sizes are exactly 5, 10 and 20"
    },
    {
     "id": "petclinic-test/src/visits.spec.ts:58",
     "verdict": "confirm",
     "why": "chooses 5 rows per page in the grid and checks the next page's rows"
    },
    {
     "id": "petclinic-backend/src/test/java/victor/training/petclinic/rest/VisitListTest.java:225",
     "verdict": "reject",
     "why": "uses size=20 but only asserts the SQL statement count, not the page size"
    }
   ]
  }
 ],
 "offered": [
  "petclinic-test/src/visits.spec.ts:47",
  "petclinic-frontend/src/app/visits/visits-page/visits-page.component.spec.ts:100",
  "petclinic-test/src/visits.spec.ts:10",
  "petclinic-frontend/src/app/visits/visits-page/visits-page.component.spec.ts:108",
  "petclinic-test/src/visits.spec.ts:58",
  "petclinic-backend/src/test/java/victor/training/petclinic/rest/VisitListTest.java:225",
  "petclinic-backend/src/test/java/victor/training/petclinic/rest/VisitListTest.java:105",
  "petclinic-backend/src/test/java/victor/training/petclinic/rest/VisitListTest.java:117",
  "petclinic-backend/src/test/java/victor/training/petclinic/rest/VisitListTest.java:73",
  "petclinic-frontend/src/app/visits/visits-page/visits-page.component.spec.ts:112",
  "petclinic-frontend/src/app/visits/visits-page/visits-page.component.spec.ts:121",
  "petclinic-frontend/src/app/visits/visit.service.spec.ts:42",
  "petclinic-test/src/visits.spec.ts:37",
  "petclinic-frontend/src/app/visits/visits-page/visits-page.component.spec.ts:75"
 ],
 "offeredDigest": {
  "petclinic-test/src/visits.spec.ts:47": "da99c4800f38685a",
  "petclinic-frontend/src/app/visits/visits-page/visits-page.component.spec.ts:100": "953db1a0b2181338",
  "petclinic-test/src/visits.spec.ts:10": "1bb534b590a1cf72",
  "petclinic-frontend/src/app/visits/visits-page/visits-page.component.spec.ts:108": "1a48be8a56e43827",
  "petclinic-test/src/visits.spec.ts:58": "1594baaffb2e1e01",
  "petclinic-backend/src/test/java/victor/training/petclinic/rest/VisitListTest.java:225": "8141ecd0423eee78",
  "petclinic-backend/src/test/java/victor/training/petclinic/rest/VisitListTest.java:105": "b06941d08c49420f",
  "petclinic-backend/src/test/java/victor/training/petclinic/rest/VisitListTest.java:117": "1fe89b175276c542",
  "petclinic-backend/src/test/java/victor/training/petclinic/rest/VisitListTest.java:73": "161ee61af6925be5",
  "petclinic-frontend/src/app/visits/visits-page/visits-page.component.spec.ts:112": "2e85c6d3ece862c7",
  "petclinic-frontend/src/app/visits/visits-page/visits-page.component.spec.ts:121": "0e8b9b28a671f1b4",
  "petclinic-frontend/src/app/visits/visit.service.spec.ts:42": "f6c67b1c8ec08233",
  "petclinic-test/src/visits.spec.ts:37": "bdedfc828c922a13",
  "petclinic-frontend/src/app/visits/visits-page/visits-page.component.spec.ts:75": "c1c5402e11c8a20c"
 }
}
